436,Ward Hayden & The Outliers - New Album!!,Brand New Original Album!!,10000.0,2179.0,live,US,USD,2020-04-14 19:02:00,2020-01-26 19:56:02,2020-03-06 19:50:24,False,31,2179.0,False,21.790000000000003,Boston,Town,Country & Folk,Music,38.966388888888886
437,4 King Royale®,A Fast Action Casino-style Card Game,2500.0,251.0,live,US,USD,2020-04-05 18:49:18,2019-10-20 23:51:30,2020-03-06 19:49:18,False,5,251.0,False,10.040000000000001,Salt Lake City,Town,Mobile Games,Games,29.958333333333332
438,Shane and Matt: An Album in 2020,Shane Brown & Matt Sulikowski on the hunt for greenbacks to fund their new duo album. Fundraiser to end 4/20 at 4:20pm,2200.0,749.0,live,US,USD,2020-04-20 23:20:00,2020-02-25 18:10:46,2020-03-06 19:44:59,False,9,749.0,False,34.04545454545455,Portland,Town,Music,,45.14931712962963
439,Kickstarting Your Dream,I'd like to launch a podcast that spotlights Kickstarter creators with current or upcoming campaigns to discuss and promote.,1000.0,1.0,live,US,USD,2020-03-27 18:38:08,2020-03-05 15:50:33,2020-03-06 19:38:08,False,1,1.0,False,0.1,Hamilton Square,Suburb,Audio,Journalism,20.958333333333332
440,Lobster Gauge Bottle Opener,#BuzzedBug,5000.0,581.0,live,US,USD,2020-05-05 19:18:56,2020-02-28 03:59:07,2020-03-06 19:18:56,False,14,581.0,False,11.62,San Diego,Town,Product Design,Design,60.0
441,Daisy Mae - Animal Crossing New Horizons enamel pin,"Daisy Mae, Animal Crossing New Horizons hard enamel pin",430.0,20.0,live,GB,GBP,2020-03-26 18:12:39,2020-03-04 14:49:01,2020-03-06 19:12:39,False,4,25.746885,False,4.651162790697675,Craven Arms,Town,Illustration,Art,19.958333333333332
442,"Japanese ""Comedy Rakugo"" US Tour",I would like to go on a Japanese comedy Rakugo US tour in all 50 states.,30000.0,15.0,live,US,USD,2020-04-11 00:00:00,2020-02-11 04:14:57,2020-03-06 19:07:05,False,3,15.0,False,0.05,New York,Town,Comedy,Theater,35.203414351851855
443,Spring Trash Animals Hard Enamel Pin,A collection of cute trash animals celebrating spring and being sassy! Hard enamel rose gold metal two pink rubber backs :),300.0,2020.0,live,US,USD,2020-03-20 18:07:03,2020-01-21 21:28:54,2020-03-06 19:07:03,False,61,2020.0,False,673.3333333333334,Greenville,Town,Illustration,Art,13.958333333333334
444,J.D. + Marley,"""J.D. + Marley"" is a USC graduate thesis -- a short film and EP about aliens, hope, and wanting to be loved...",11111.0,4321.0,live,US,USD,2020-04-03 19:12:00,2020-02-15 20:00:44,2020-03-06 19:04:10,False,40,4321.0,False,38.889388893888935,Los Angeles,Town,Shorts,Film & Video,28.005439814814814
445,"Monsters! Monsters rpg &""Toughest Dungeon in the World"" solo","A new updated edition of the Monsters! Monsters! RPG. And a new edition of the ""Toughest Dungeon in the World"" a solitaire adventure.",7777.0,19726.13,live,US,USD,2020-04-05 18:00:42,2020-01-10 20:13:56,2020-03-06 19:00:42,False,581,19726.13,False,253.64703613218467,Scottsdale,Town,Tabletop Games,Games,29.958333333333332
446,Fire Emblem Enamel Pins,The beloved characters who stole our hearts as enamel pins!,400.0,1718.0,live,US,USD,2020-04-05 18:00:12,2020-02-10 02:30:18,2020-03-06 19:00:12,False,47,1718.0,False,429.5,Missoula,Town,Art,,29.958333333333332
447,Deep Carbon Observatory Remastered,"A remaster of the D&D adventure 'Deep Carbon Observatory', now in A4 hardback.",3000.0,20657.0,live,GB,GBP,2020-04-07 22:00:00,2020-02-28 15:16:35,2020-03-06 19:00:05,False,869,26592.67017225,False,688.5666666666666,Birkenhead,Town,Tabletop Games,Games,32.12494212962963
448,Adventurers League Enamel Pin Collection,An enamel pin collection based off of classic RPG classes.,1200.0,141.0,live,US,USD,2020-03-22 19:00:00,2019-12-01 17:13:09,2020-03-06 19:00:03,False,5,141.0,False,11.75,Rocklin,Town,Accessories,Fashion,15.999965277777777
449,Buffy the Vampire Slayer: Ladies of the Hellmouth pins,"A set of enamel pins based on my favorite ladies in Buffy the Vampire Slayer! Welcome to the Hellmouth, let's go!",350.0,388.0,live,US,USD,2020-04-05 18:00:01,2020-02-17 21:25:21,2020-03-06 19:00:01,False,16,388.0,False,110.85714285714286,Salt Lake City,Town,Art,,29.958333333333332
450,Endless Time (Luxury Dark) Playing Cards,Custom Playing Cards created for magicians and cardists.,14000.0,5215.0,live,GB,GBP,2020-04-05 17:59:51,2020-02-19 17:34:43,2020-03-06 18:59:51,False,132,6713.50026375,False,37.25,Tallinn,Town,Playing Cards,Games,29.958333333333332
451,VOX: 2020 EP - Fundraiser,Vox is recording our debut EP!!!!!,600.0,631.0,live,US,USD,2020-04-01 03:59:00,2020-03-04 03:24:09,2020-03-06 18:20:28,False,21,631.0,False,105.16666666666667,Tallahassee,Town,Art,,25.401759259259258
452,Shannon Hawley's Second Studio Album,An album of songs based on women's stories and experiences.,12000.0,2865.0,live,US,USD,2020-04-11 06:59:00,2020-01-08 20:25:19,2020-03-06 18:20:06,False,26,2865.0,False,23.875,Hollywood,Suburb,Country & Folk,Music,35.52701388888889
453,SleepX Neckrest®- the travel pillow that actually works!,SleepX Neckrest® allows you to relax your neck and sleep while in upright seated posture.,10000.0,1361.0,live,DE,EUR,2020-04-05 18:17:39,2020-02-27 10:09:08,2020-03-06 18:17:39,False,20,1515.94470542,False,13.61,Aachen,Town,Product Design,Design,30.0
454,Connla Album No. 3,The third album from Modern Trad group Connla.,5000.0,1802.0,live,GB,GBP,2020-05-05 17:10:32,2020-02-25 18:21:58,2020-03-06 18:10:32,False,27,2319.7943385,False,36.04,Derry,LocalAdmin,World Music,Music,59.958333333333336
455,Transformation; Saul To Paul II A Bible Brickfilm,Saul is persecuting Christians and things can only change with Jesus.  A Bible brickfilm.,1000.0,1007.0,live,US,USD,2020-05-05 17:06:34,2019-09-20 16:28:18,2020-03-06 18:06:34,False,25,1007.0,False,100.69999999999999,Orlando,Town,Animation,Film & Video,59.958333333333336
456,Project: Blaze,"A 2D Indie Action, Side Scroller Adventure Game, involving a turn based RPG battle mechanic with a chaining system.",30.0,2.0,live,GB,GBP,2020-05-05 17:06:32,2020-02-26 00:41:17,2020-03-06 18:06:32,False,2,2.5746885,False,6.666666666666667,Bromley,Suburb,Video Games,Games,59.958333333333336
457,Victory Lap,An LGBTQ+ young adult novel.,9000.0,2211.29,live,CA,CAD,2020-04-05 17:04:36,2020-03-02 14:55:39,2020-03-06 18:04:36,True,31,1650.4997135333,False,24.569888888888887,Toronto,Town,Young Adult,Publishing,29.958333333333332
458,Clive and Maude,"A short, romantic caper that takes place in real time.",3000.0,1474.0,live,GB,GBP,2020-04-05 16:51:50,2020-02-24 13:16:52,2020-03-06 17:51:50,False,18,1897.5454245,False,49.13333333333333,Gloucestershire,County,Narrative Film,Film & Video,29.958333333333332
459,[PINK DRAGONS] - evolution hard enamel pins,"designed with love, will they be yours?",600.0,821.32,live,AU,AUD,2020-04-25 16:50:28,2020-02-10 09:30:45,2020-03-06 17:50:28,False,41,543.6767738284,False,136.88666666666666,Perth,Town,Accessories,Fashion,49.958333333333336
460,"Nikki O'Neill's New Album: ""World is Waiting""","Nikki O'Neill's third album, recorded in LA and Memphis, is a vibrant tapestry of soul-influenced Americana, blues and gospel.",1000.0,206.0,live,US,USD,2020-04-20 06:55:00,2019-05-02 10:36:54,2020-03-06 17:40:45,False,9,206.0,False,20.599999999999998,Los Angeles,Town,Blues,Music,44.5515625
461,KDM Monster Organizer — Board game boxes finally made smart,Kingdom Death Monster box redesigned to be your game companion — because game boxes should be much more than dust gatherers!,3000.0,8490.0,live,IT,EUR,2020-05-05 16:36:56,2020-01-20 16:28:38,2020-03-06 17:36:56,False,94,9456.5544078,False,283.0,Milano,Town,Tabletop Games,Games,59.958333333333336
462,Nueva marca de ropa,Crear una nueva marca de ropa independiente de las que hay ahora con un concepto propio e innovador.,2500.0,1.0,live,ES,EUR,2020-04-05 16:16:03,2020-03-05 16:25:13,2020-03-06 17:16:03,False,1,1.11384622,False,0.04,Tàrrega,Town,Apparel,Fashion,29.958333333333332
463,Faro's American Safari -- UTAH EDITION -- Mad Max Mutants,"March Madness brings Mad Max Mutants - Jubilee & The Juggernaut - Apocalypse Now Covers along w/ a special Wanda-Vision Chopper Poster,",5000.0,4792.0,live,US,USD,2020-04-01 03:59:00,2020-03-03 17:55:18,2020-03-06 17:13:13,False,76,4792.0,False,95.84,Lake Worth,Town,Anthologies,Comics,25.44846064814815
464,Everything's Gonna Be Alrite,"A Hip Hop album to help rebuild Dayton, Ohio after the Memorial Day Tornado Event of 2019",9000.0,599.0,live,US,USD,2020-04-01 03:59:00,2020-01-15 18:24:03,2020-03-06 17:06:56,False,11,599.0,False,6.655555555555556,Dayton,Town,Hip-Hop,Music,25.452824074074073
465,Daffodil,My 3D animated senior thesis film about a man moving on from the death of his wife at a much earlier age than expected.,500.0,500.0,live,US,USD,2020-04-23 04:00:00,2020-03-06 14:58:23,2020-03-06 17:05:26,False,5,500.0,False,100.0,New York,Town,Animation,Film & Video,47.45456018518519
466,Baby Life Seat,Next-generation design in government certified baby safety seats for all transportation!,450000.0,151.0,live,US,USD,2020-05-05 16:04:03,2019-12-13 22:54:35,2020-03-06 17:04:03,False,3,151.0,False,0.03355555555555556,Wilmington,Town,Product Design,Design,59.958333333333336
467,AFK Season Three - The Final Season!,Help us conclude New Zealand's most epic fantasy / gaming webseries.,250000.0,64425.95,live,NZ,NZD,2020-04-07 06:00:00,2020-02-17 05:47:37,2020-03-06 17:00:27,False,540,40590.30704888,False,25.77038,Auckland,Town,Fantasy,Film & Video,31.541354166666668
468,Year One at Hogwarts ⚡️ Hard Enamel Pins,Harry Potter inspired enamel pins showcasing year one at Hogwarts.,500.0,635.29,live,CA,CAD,2020-04-11 03:59:00,2020-02-26 21:37:53,2020-03-06 17:00:01,False,18,474.1784040133,False,127.05799999999998,Toronto,Town,Illustration,Art,35.457627314814815
469,Galar Gym Leader Buttons,Pokemon button designs of the Galar Gym leaders from Sword and Shield,289.0,17.0,live,US,USD,2020-03-19 04:30:00,2020-03-05 00:24:20,2020-03-06 16:57:51,False,3,17.0,False,5.88235294117647,Granbury,Town,Accessories,Fashion,12.480659722222223
470,Dead Tired Enamel Pin,Existential dread? Check. Kawaii aesthetic? Check. Maybe you're just Dead Tired too?,300.0,144.0,live,GB,GBP,2020-03-27 15:56:13,2020-03-02 16:04:20,2020-03-06 16:56:13,False,14,185.377572,False,48.0,Northampton,Town,Apparel,Fashion,20.958333333333332
471,InteriorCollab.,A platform to connect clients and designers,10000.0,1.0,live,US,USD,2020-05-05 15:50:43,2019-11-05 23:45:09,2020-03-06 16:50:43,False,1,1.0,False,0.01,New York,Town,Design,,59.958333333333336
472,The Arch Pocket Top,"A brass pocket top with five different finishes.  A top spin time of 10 minutes. CNC machined. Fidget, spin, relax, spin spin spin.",1080.0,2275.0,live,US,USD,2020-04-05 16:49:14,2019-11-23 18:04:25,2020-03-06 16:49:14,False,24,2275.0,False,210.64814814814815,Indianapolis,Town,Product Design,Design,30.0
473,Rest in Him,A YouTube channel hosting Christian Relaxation. Exploring the beauty of word to settle our minds.,2000.0,17.0,live,GB,GBP,2020-04-05 15:47:44,2020-02-25 19:24:12,2020-03-06 16:47:44,False,4,21.88485225,False,0.8500000000000001,Darlington,Town,Film & Video,,29.958333333333332
474,Woodchip does backyard BBQ,"A book for new BBQ cooks to learn backyard cooking on smokers, grills, electric grills, and gas grills. Also brief history of BBQ.",3600.0,1.0,live,US,USD,2020-04-05 15:46:42,2020-02-27 18:25:30,2020-03-06 16:46:42,False,1,1.0,False,0.027777777777777776,Heavener,Town,Cookbooks,Food,29.958333333333332
475,ATÓMIKA,Atómika nos muestra que la autenticidad de uno mismo puede vencer nuestros miedos más profundos.,30000.0,11118.8,live,MX,MXN,2020-04-05 15:41:33,2020-03-03 23:23:03,2020-03-06 16:41:33,True,19,568.661686208,False,37.062666666666665,Guadalajara,Town,Film & Video,,29.958333333333332
476,MakeME Happy!! – Follow your Heart!,"MakeME Happy is a lovely and cute game, and the mechanics are easy for anyone to pick up and master!",1299.0,10.0,live,US,USD,2020-04-19 16:28:57,2019-12-26 12:25:59,2020-03-06 16:28:57,False,2,10.0,False,0.7698229407236336,New York,Town,Mobile Games,Games,44.0
477,Destiny Friends Enamel Pins,Enamel Pins of your favourite tragedy trios,400.0,3214.0,live,US,USD,2020-04-05 15:06:29,2020-02-17 01:59:46,2020-03-06 16:06:29,False,78,3214.0,False,803.5,West Lafayette,Town,Accessories,Fashion,29.958333333333332
478,Nomadic SARLAG /yak/ leather messenger bag,SARLAG (Yak) leather:  Still accepting Pre-Orders for a limited time.,5000.0,5599.0,live,FR,EUR,2020-04-16 01:00:00,2020-01-14 15:03:03,2020-03-06 16:05:23,False,33,6236.42498578,False,111.97999999999999,Ulan Bator,Town,Product Design,Design,40.371261574074076
479,Broken - the card game,Broken is a card game about Kickstarter failure for 2-5 players and delivering some really good excuses,560.0,563.0,live,DE,EUR,2020-04-05 20:00:00,2020-02-23 21:36:08,2020-03-06 16:00:29,False,24,627.09542186,False,100.53571428571428,Hilden,Town,Tabletop Games,Games,30.16633101851852
480,Orphan and Forgotten,A mystery story about a teenaged girl who's life turns upside-down after a horrific fire.,2000.0,1.29,live,CA,CAD,2020-03-21 14:57:41,2019-10-04 13:53:02,2020-03-06 15:57:41,False,1,0.9628518333,False,0.0645,Elmvale,Town,Fiction,Publishing,14.958333333333334
481,A survey based magazine,"A magazine about surveys, statistics and opinion in everyday life",2000.0,1.29,live,CA,CAD,2020-04-05 14:55:53,2020-03-06 04:58:39,2020-03-06 15:55:53,False,1,0.9628518333,False,0.0645,Reinfeld,Town,Journalism,,29.958333333333332
482,Security Guard XR Ultra,An fps inspired artbook about a group of redundant security guards.,200.0,1560.0,live,GB,GBP,2020-03-26 14:53:14,2020-03-02 10:37:29,2020-03-06 15:53:14,False,49,2008.25703,False,780.0,London,Town,Art Books,Publishing,19.958333333333332
483,Isabelle Crossing Enamel Pin!,Help fund a batch of 100 Isabelle Crossing hard enamel pins,350.0,240.0,live,US,USD,2020-04-05 19:00:00,2020-03-04 19:56:20,2020-03-06 15:52:29,False,17,240.0,False,68.57142857142857,Fort Collins,Town,Product Design,Design,30.130219907407408
484,Global Swarming,Global Swarming: a printed manual of 72 illustrated strategies to [re]verse climate change and [re]green the planet.,5000.0,428.0,live,DE,EUR,2020-04-05 14:51:59,2019-11-27 16:12:20,2020-03-06 15:51:59,False,11,476.72618216,False,8.559999999999999,London,Town,Publishing,,29.958333333333332
485,Pink Moon,"Alex is drunk, heartbroken, and surprisingly a really good shot.",442.0,34.29,live,CA,CAD,2020-04-05 14:38:45,2020-02-29 22:56:18,2020-03-06 15:38:45,False,9,25.5939452433,False,7.757918552036198,Toronto,Town,Comics,,29.958333333333332
486,Wood Covered Gamer Books,"Kickstarter ""Gamer Book"" Edition",3000.0,236.0,live,US,USD,2020-03-20 15:23:34,2020-03-04 17:40:13,2020-03-06 15:23:34,False,6,236.0,False,7.866666666666666,Denver,Town,Games,,14.0
487,Reviso.ai turns Lecture Slides into Interactive Quizzes!,"Got exams?

Ever struggle to remember an acronym, a fact, or a reference?

Enjoy effective, fun revision - and nail your next exam!",3000.0,202.0,live,GB,GBP,2020-03-17 23:51:00,2020-02-14 20:54:07,2020-03-06 15:22:40,False,9,260.0435385,False,6.7333333333333325,Brighton,Town,Web,Technology,11.35300925925926
488,CAMP VA07 #1,The new dystopia post apocalyptic thriller from the writer of the award winning City of Lost Souls.,2200.0,698.0,live,GB,GBP,2020-03-29 19:00:00,2020-03-02 11:31:23,2020-03-06 15:16:36,False,52,898.5662865,False,31.727272727272727,Kirknewton,Town,Comic Books,Comics,23.15513888888889
489,The Adventures of Abendigo Bunny... elevating every child,Publishing The Adventures of Abendigo Bunny with the companion board game and charactors for Abendigo's Cafe & Cupcakes,20000.0,1.0,live,US,USD,2020-04-05 13:42:00,2020-03-03 21:52:32,2020-03-06 14:42:00,False,1,1.0,False,0.005,Houston,Town,Children's Books,Publishing,29.958333333333332
490,"Make Art, Will Travel/ Fruiting Bodies: A Printstallation",I am heading to two international artist residencies to create Installation work using Printmaking.,6000.0,1346.0,live,US,USD,2020-04-18 04:00:00,2020-02-25 21:30:08,2020-03-06 14:24:26,False,18,1346.0,False,22.433333333333334,Buenos Aires,Town,Mixed Media,Art,42.56636574074074
491,Eli's Jungle: Children's Book on Tolerance,"A children's book about tolerance, illustrated through the beauty of African animals.",30.0,31.0,live,US,USD,2020-04-05 13:22:38,2020-02-19 17:39:51,2020-03-06 14:22:38,False,3,31.0,False,103.33333333333334,Chicago,Town,Children's Books,Publishing,29.958333333333332
492,The Mighty Pines' New Album: Late Last Night,This album is the culmination of our personal and musical growth as The Mighty Pines. We're asking for your help to share our music.,34800.0,4013.69,live,US,USD,2020-04-05 13:15:28,2020-02-19 01:24:00,2020-03-06 14:15:28,False,42,4013.69,False,11.533591954022988,St. Louis,Town,Music,,29.958333333333332
493,Valhalla in the Fall 2020,The ultimate gaming retreat in the beautiful mountains of Utah.,22000.0,24453.0,live,US,USD,2020-04-05 04:00:00,2020-02-24 00:41:55,2020-03-06 14:00:07,False,18,24453.0,False,111.14999999999999,Heber City,Town,Tabletop Games,Games,29.583252314814814
494,MYSTIK: A next-generation portable cassette player,MYSTIK: a Bluetooth cassette player that walks the line between modern features and preserving the analog integrity so many desire,50000.0,23488.0,live,FR,EUR,2020-04-07 12:59:08,2020-01-23 22:02:52,2020-03-06 13:59:08,False,169,26162.02001536,False,46.976,Paris,Town,Sound,Technology,31.958333333333332
495,Personalized Education | ベテラン大学講師が作った渾身の英語セミナー講座と個別コーチング,ベテラン大学講師により効果的な英語コミュニケーションスキルを学び、更に独占ライブ練習権も獲得できます！,5000.0,371.0,live,US,USD,2020-04-05 12:52:39,2020-02-18 02:54:57,2020-03-06 13:52:39,False,4,371.0,False,7.42,Osaka-shi,Town,Webseries,Film & Video,29.958333333333332
496,FoddSquad Morale Patch,An initial run of FoddSquad hook-and-loop backed community patches,300.0,98.0,live,US,USD,2020-04-05 12:49:51,2019-10-08 21:50:52,2020-03-06 13:49:51,False,7,98.0,False,32.666666666666664,Denver,Town,Video Games,Games,29.958333333333332
497,VitruviArt Basel,Sustainable swimming shorts with an extravagant wearing experience.,10000.0,298.0,live,CH,CHF,2020-04-05 12:29:46,2020-03-03 09:04:37,2020-03-06 13:29:46,False,3,311.67179598,False,2.98,Basel,Town,Ready-to-wear,Fashion,29.958333333333332
498,Under Wraps: A Social Realist Short Film,An East London teenager struggles to regain his life after an acid attack leaves his face in bandages.,2200.0,344.0,live,GB,GBP,2020-03-30 19:00:00,2020-03-03 11:54:23,2020-03-06 13:14:33,False,11,442.846422,False,15.636363636363637,Cheltenham,Town,Drama,Film & Video,24.239895833333332
499,Video Stars,"Una piattaforma di streaming video in cui vengono pubblicati film e serie interpretate da influencer, trame originali a senso educativo",85500.0,1.0,live,IT,EUR,2020-04-25 11:57:20,2020-02-11 19:37:29,2020-03-06 12:57:20,False,1,1.11384622,False,0.0011695906432748538,Milano,Town,Webseries,Film & Video,49.958333333333336
500,Fairies of the woods: illustrated Artbook project,"Fairies are all around the woods, and now you can meet some of them in this artbook fully illustrated to know them!",60.0,623.0,live,ES,EUR,2020-04-05 11:25:57,2020-03-06 08:03:34,2020-03-06 12:25:57,False,34,693.92619506,False,1038.3333333333333,Elx,Town,Art Books,Publishing,29.958333333333332
501,Dust Bunny Mafia: The Blind Tiger Comic Collection,"When a sugar ban goes into effect, the mafia sees an opportunity until the cops catch on. It's like Looney Tunes meets The Godfather.",2500.0,1408.0,live,US,USD,2020-03-28 02:00:00,2020-02-11 23:40:24,2020-03-06 12:22:01,False,28,1408.0,False,56.32,Chicago,Town,Webcomics,Comics,21.56804398148148
502,"Help ""SCHENGEN SHUFFLE"" album go VINYL","Help us produce our 3rd album ""Schengen Shuffle"" in CD, VINYL already recorded this winter in Budapest, Hungary",1000.0,226.0,live,US,USD,2020-03-31 09:59:00,2020-03-03 14:49:14,2020-03-06 12:09:36,False,11,226.0,False,22.6,Budapest,Town,Punk,Music,24.909305555555555
503,Head for Glory,A fast-paced arena fighting game. Expand your Tableau and build your dice-pool. Draft your abilities and decapitate your opponents.,28000.0,7355.0,live,DE,EUR,2020-04-02 17:00:00,2020-01-06 09:27:17,2020-03-06 11:30:45,False,80,8192.3389481,False,26.267857142857142,Darmstadt,Town,Tabletop Games,Games,27.228645833333335
504,Cake Studio Cookbook,Hi! I am a Pastry Chef and this project is about publishing a cookbook with my own cake recipes.,11700.0,111.0,live,AT,EUR,2020-04-05 10:07:49,2020-02-24 21:50:41,2020-03-06 11:07:49,False,3,123.63693042,False,0.9487179487179488,Vienna,Town,Nonfiction,Publishing,29.958333333333332
505,The Vibing Vegan,Eat Clean...Catch the Vibe!,10000.0,1.0,live,US,USD,2020-05-05 10:02:02,2019-03-17 00:30:54,2020-03-06 11:02:02,False,1,1.0,False,0.01,Inglewood,Town,Vegan,Food,59.958333333333336
506,Adieu aux Alpes,"Climbing the Alps' 4000m peaks quickly under human power, and documenting the dramatic toll of climate change.",4000.0,1466.0,live,US,USD,2020-05-01 15:00:00,2020-02-24 14:01:55,2020-03-06 11:01:53,False,22,1466.0,False,36.65,Zermatt,Town,Nonfiction,Publishing,56.165358796296296
507,Guitarists! We're back with TorinoAudio Organic FX Pedals!,"Analogue, Modular, Discrete Components. No Buffers.  Made For The Players.",45000.0,1891.0,live,IT,EUR,2020-04-20 10:00:08,2019-01-30 14:52:57,2020-03-06 11:00:08,False,11,2106.28320202,False,4.202222222222223,Turin,Town,DIY Electronics,Technology,44.958333333333336
508,"Fusion - Connecting People, Impacting Communities","Imagine a world united with shared values and goals, to bring communities together, learn from one another and make a difference.",15000.0,334.0,live,GB,GBP,2020-04-05 09:06:15,2020-01-22 14:58:39,2020-03-06 10:06:15,False,8,429.9729795,False,2.2266666666666666,Chitral,Town,Embroidery,Crafts,29.958333333333332
509,Great women on the moon poster,Only a few women have their names on the moon. Who are they? and where are these names?,500.0,2301.0,live,ES,EUR,2020-03-17 21:25:00,2020-03-03 09:22:52,2020-03-06 09:45:25,True,38,2562.96015222,False,460.20000000000005,Barcelona,Town,Graphic Design,Design,11.48582175925926
510,Already but not Yet,"A photobook, by Jordi Barreras, that investigates the modern subject and neoliberalism's labour conditions",6500.0,1006.0,live,GB,GBP,2020-04-05 07:52:33,2020-03-03 10:37:58,2020-03-06 08:52:33,True,23,1295.0683155,False,15.476923076923077,London,Town,Photobooks,Photography,29.958333333333332
511,Ship Wrecked: Quarantined on a Rave Cruise for 24 days,A digital-short series chronicling the infection of a cruise by a novel virus and it's subsequent quarantine.,5000.0,1.0,live,US,USD,2020-04-16 06:39:00,2020-03-06 07:30:23,2020-03-06 08:42:14,False,1,1.0,False,0.02,Los Angeles,Town,Comedy,Film & Video,40.9144212962963
512,Bliss,An intense Hack & Slash game with RPG features and countless combos!,12000.0,1155.0,live,US,USD,2020-04-05 07:21:28,2020-02-10 19:55:28,2020-03-06 08:21:28,False,51,1155.0,False,9.625,Santa Rosa,Town,Video Games,Games,29.958333333333332
513,Killer Call Girl,"Story about a high-class escort and hostess, who is horribly mistreated by a group of men then seeks revenge.",5000.0,1.32,live,AU,AUD,2020-05-05 07:07:05,2020-03-05 06:39:54,2020-03-06 08:07:05,False,1,0.8737804284,False,0.026400000000000003,Brisbane,Town,Fiction,Publishing,59.958333333333336
514,Virtual Reality Tischkicker Event,Experience VR - Die Event-Idee,6900.0,1.0,live,DE,EUR,2020-03-31 10:00:00,2020-02-10 11:24:09,2020-03-06 07:58:19,False,1,1.11384622,False,0.014492753623188406,Aachen,Town,Technology,,25.084502314814817
515,Grand Raid Reunion Island,"100 miles : ""La Diagonale des fous""",6000.0,136.0,live,FR,EUR,2020-04-19 20:00:00,2020-02-17 14:40:06,2020-03-06 07:56:54,False,4,151.48308592,False,2.2666666666666666,Saint-Denis,Town,Comics,,44.50215277777778
516,"EYES, safer online dating.","Safer dating app, online dating needs to be made safer. 3 second live recording of your facial expression eliminating fake profiles.",10000.0,12.0,live,GB,GBP,2020-05-05 06:47:45,2020-02-26 19:50:53,2020-03-06 07:47:45,False,3,15.448131,False,0.12,Preston,Suburb,Camera Equipment,Technology,59.958333333333336
517,AMADEO - SNEAKER ROCKSTYLE - HANDMADE IN SPAIN,Sneakers with soul - Animal Free.,6600.0,1029.0,live,ES,EUR,2020-04-10 06:21:00,2019-10-14 08:38:12,2020-03-06 07:21:00,False,14,1146.14776038,False,15.590909090909092,Alicante,Town,Footwear,Fashion,34.958333333333336
518,Alien Realities | A short docudrama by Superstar X,"Two siblings are separated by the alien realities of schizophrenia, forcing them to find an otherworldly way to reconnect.",360000.0,751.29,live,CA,CAD,2020-04-01 03:59:00,2020-02-25 19:27:47,2020-03-06 05:26:37,False,9,560.7604293333,False,0.20869166666666666,Toronto,Town,Documentary,Film & Video,25.939155092592593
519,After the Shipwreck,"The 10 songs on this musical collection are about picking up the pieces, following the unexpected death of a close loved one.",5000.0,521.29,live,CA,CAD,2020-03-22 06:11:00,2020-02-25 07:00:24,2020-03-06 05:04:11,False,16,389.0891722333,False,10.425799999999999,Sooke,Town,Music,,16.046400462962964
520,"Quotes from Far, Far Away: Part 2 - An Enamel Pin Series",More enamel pins inspired by Star Wars.,100.0,275.0,live,US,USD,2020-04-01 01:00:00,2020-01-08 21:25:38,2020-03-06 03:56:19,False,12,275.0,False,275.0,Chicago,Town,Accessories,Fashion,25.87755787037037
521,Republican,republican t shirt design for 2020,6000.0,64.0,live,US,USD,2020-05-05 02:20:17,2020-03-03 22:15:13,2020-03-06 03:20:17,False,2,64.0,False,1.0666666666666667,Albuquerque,Town,Apparel,Fashion,59.958333333333336
